文物id,文物名称,文物来源,文物图标,文物颜色,文物描述
1,有瑕疵的耳环,森海山脉,wenwu_1,1,山缝里拾来的耳环，风吹雨打下早已失去往日的光泽。
2,蒙灰的水瓶,森海山脉,wenwu_2,1,不知是谁掉落的水瓶，水垢和灰尘厚到洗不掉。
3,破损的长裙,森海山脉,wenwu_3,1,一条精灵族的长裙，尽管破烂不堪，仍能看出工艺的精细。
4,月光小镜子,森海山脉,wenwu_4,1,一面巴掌大的小镜子，有少许裂痕，但仍光亮如新。
5,粉红珍珠串,森海山脉,wenwu_5,2,上等粉红珍珠做成的手串，岁月没有抹去珠母的光泽，依旧晶莹剔透。
6,祭祀残卷,森海山脉,wenwu_6,2,远古祭祀时遗留下来的书卷，由于残破加浸泡很多地方已看不清字。
7,水晶头冠,森海山脉,wenwu_7,3,水晶雕成的头冠，从光滑的切割面可以想象它戴在精灵族美丽的长发上的样子。
8,圆月弯刀,森海山脉,wenwu_8,3,如一弯新月般闪着冷冷寒光的锋利弯刀，从刀柄上可以看主人已用了很久。
9,碧龙之戒,森海山脉,wenwu_9,4,碧色的长龙盘成一个圆弧形，一枚做工精雕细琢的祭司戒指，其中蕴含的的法力隐隐透出微光。
10,女神光之项链,森海山脉,wenwu_10,5,一串由上等宝石打造而成的项链，巧夺天工令人赞叹，漆黑的夜里也散发着耀眼的光芒。
11,简陋的头巾,黑暗龙穴,wenwu_11,1,布制粗糙的简陋头巾，有被人强行撕开的痕迹，可能是做了用来包扎的布条。
12,旅人的皮囊袋,黑暗龙穴,wenwu_12,1,旅行人士常随身携带的皮囊袋，用来装清水或者美酒。如今袋子里已空无一物。
13,焦黑的长刀,黑暗龙穴,wenwu_13,1,被火焰烧的焦黑，一碰即裂的长刀。可能是某位勇士与龙博斗后留下的。
14,开裂的面具,黑暗龙穴,wenwu_14,1,一面做工良好的石龟面具，上面有被刀砍开的痕迹。
15,锐利的匕首,黑暗龙穴,wenwu_15,2,一把锋利短小的匕首，虽然有缺口，却依旧锋利如昔。
16,短管猎枪,黑暗龙穴,wenwu_16,2,短管的小型猎枪，很久没有使用过了，不知道枪上膛后还能不能正常射击。
17,猎龙战盔,黑暗龙穴,wenwu_17,3,屠龙勇士戴的战盔，做工笨重却威武，可以很好的抵御攻击。
18,驭龙颈环,黑暗龙穴,wenwu_18,3,龙所戴的颈环，还留有锁链的痕迹。从颈环的做工看，龙很受主人的喜欢。
19,远古魔典,黑暗龙穴,wenwu_19,4,远古时代残存留下的魔典，记载了不少龙族的历史与秘术。
20,雷霆斩剑,黑暗龙穴,wenwu_20,5,集合雷霆万钧之力的重剑，能砍裂坚硬的龙麟甲，龙族对它无计可施。
21,学徒胸针,守护之塔,wenwu_21,1,法师学徒留下的胸针，小小的甚是精美。上面还留有学徒的名字与等级。
22,生锈的果盘,守护之塔,wenwu_22,1,已经生出片片铁锈的果盘，上面刻有一些简单的图案。
23,掉漆的画框,守护之塔,wenwu_23,1,空荡荡的画框，金漆掉落露出里面的象牙质地，上面的画已荡然无存。
24,断裂的鹅毛笔,守护之塔,wenwu_24,1,已不能再使用的鹅毛笔，此笔是法师专用，金色的笔尖上有细小的符文和墨水痕迹。
25,黯淡斗篷,守护之塔,wenwu_25,2,已穿戴了很多年的旧斗篷，看样子是守塔人穿的，上面滴满了灯油。
26,庄严的画像,守护之塔,wenwu_26,2,一幅传世很久的大法师肖像画，从落款和画风可以看出它已摆在这里很久了。
27,传送秘典,守护之塔,wenwu_27,3,记载了各种秘法的宝典书，可以将使用者传送到任何想去的地方。
28,光辉宝典,守护之塔,wenwu_28,3,记载有各种光辉法术的宝典，是历代大法师的心血之作。
29,暗影法袍,守护之塔,wenwu_29,4,可以隐蔽在黑夜中的法袍，是昼伏夜出的黑魔法师的最爱。
30,苍穹圣法帽,守护之塔,wenwu_30,5,加持了圣法庇护的法帽，戴着它的法师在战场也是横行无阻。
31,坏掉的怀表,荆棘海岸,wenwu_31,1,精致的怀表，表链还是完整的。但是在海里跑了太久，时针已经停止走动了。
32,私藏的铜币,荆棘海岸,wenwu_32,1,海船上船员偷藏的钱币，好像是古早时期留下的，已不知道传了多少代了。
33,补丁皮手套,荆棘海岸,wenwu_33,1,打上了补丁的破手套，洗一洗大概勉强还能继续使用。
34,海盐结晶,荆棘海岸,wenwu_34,1,利用海水提纯而出的一小瓶海盐，可能是海员为了腌制鱼虾准备的。
35,航海望远镜,荆棘海岸,wenwu_35,2,航海必不可少的大宝贝。运用特殊材质做成，掉入海底也不会腐烂。
36,木制船舵,荆棘海岸,wenwu_36,2,不知是哪搜船上掉下来的船舵，从纹理和磨损的程度看，已经使用了很多年。
37,宝藏地图,荆棘海岸,wenwu_37,3,绘制有海湾中心宝藏的藏宝地图，可惜好几个重要路线已经磨损不清了。
38,深海之心吊坠,荆棘海岸,wenwu_38,3,巨大的蓝宝石吊坠，是价值连城的宝物，据说是大财主的珍藏品。
39,苍蓝之心戒指,荆棘海岸,wenwu_39,4,镶嵌有千中选一的海蓝钻石的精美戒指，据说是财主献给国王的礼物。
40,黄金风暴之剑,荆棘海岸,wenwu_40,5,纯金打造而成的宝剑，上手轻盈，却能战无不胜。
41,腐化的龙牙,龙翼巢穴,wenwu_41,1,一颗龙掉落的蛀牙，仿佛受到了什么东西的腐蚀而烂掉了一部分。
42,编织护腕,龙翼巢穴,wenwu_42,1,手工艺编织成的战斗护腕，据说这种护腕防毒又防火。
43,龙颚碎片,龙翼巢穴,wenwu_43,1,龙被打掉的下颚碎片化石，看来这里发生过非常惨烈的战斗。
44,龙身雕像,龙翼巢穴,wenwu_44,1,一座小小的神龙雕像，雕刻了至高无上的龙族形象。
45,纯净龙鳞,龙翼巢穴,wenwu_45,2,龙身上脱落的龙鳞，这些龙鳞比最硬的铁甲还要坚硬，几乎刀枪不入。
46,龙须药材,龙翼巢穴,wenwu_46,2,龙脱落的龙须，细长泛着微光，是一种做药剂或者魔杖的上等药材。
47,猛龙腰带,龙翼巢穴,wenwu_47,3,雕刻有猛龙图案的腰带，是屠龙团标志性的宝物。
48,龙纹披风,龙翼巢穴,wenwu_48,3,刺绣有龙纹的披风，打仗胜利凯旋时会将披风做成旗帜挥舞。
49,龙皮铠甲,龙翼巢穴,wenwu_49,4,王族成员的铠甲，用同龙族兄弟姐妹褪下的龙皮制成，坚不可摧。
50,龙焰王冠,龙翼巢穴,wenwu_50,5,王的象征物品，只有最强大的龙才能佩戴。拥有者可以号令整个龙族。
51,房屋的瓦片,遗忘古地,wenwu_51,1,这里的水域曾经是一片繁华的都市，但现在只能看到昔日房屋残破的瓦片了。
52,盛水的陶罐,遗忘古地,wenwu_52,1,城镇人家所使用的陶罐，有时候里面会装有逝去宠物的遗体。但这个是空的。
53,奶酪化石,遗忘古地,wenwu_53,1,传说级的美食，当年大都市的畅销商品。可惜现在已经不能知道是什么滋味了。
54,侍女面纱,遗忘古地,wenwu_54,1,宫廷侍女的面纱，做工良好，质地轻柔，可以想象出当年戴在侍女脸上的样子。
55,华美的刀鞘,遗忘古地,wenwu_55,2,做工令人叹为观止的刀鞘，花纹繁复到眼花缭乱。可能是哪个贵族公子当年遗留的。
56,金铃铛脚环,遗忘古地,wenwu_56,2,细小的金圈上镶嵌了许多更细小的铃铛，多年前，它曾在一位绝色舞娘的脚踝上叮当作响。
57,水晶烛台,遗忘古地,wenwu_57,3,水晶做成的烛台，水晶都做成仿佛要滴落的样子。工艺之华美，显然是贵族所用的。
58,琉璃夜光杯,遗忘古地,wenwu_58,3,琉璃雕成的夜光酒杯，尽管杯中已无美酒，那玲珑剔透的光芒仍让它美的耀眼。
59,荣耀宝珠,遗忘古地,wenwu_59,4,上等稀有珠宝串成的珠链，链子中有细碎的装饰品。它象征着国王赐予的荣耀。
60,雄鹰卓越之刃,遗忘古地,wenwu_60,5,最英武无畏的战士才能享用的宝剑，剑柄被雕琢成雄鹰的样子。一见便知是绝世好剑。
61,螺旋蜗牛壳,紫晶森林,wenwu_61,1,一种稀有的蜗牛壳，因为独特的螺旋壳纹而常常被人做成装饰。上面还有穿孔的痕迹。
62,矮人臭袜子,紫晶森林,wenwu_62,1,从大小和使用情况看，是矮人穿过的袜子。不知是不是放的时间太久，有一股非常令人窒息的味道。
63,木制啤酒杯,紫晶森林,wenwu_63,1,很大号的木制啤酒杯，不亚于一个小酒桶了。可以想象当年矮人们喝酒狂欢的样子。
64,骨头骰子,紫晶森林,wenwu_64,1,猪骨头做成骰子，造型圆润，是矮人们喝酒助兴的玩具。
65,银制哨子,紫晶森林,wenwu_65,2,白银打造而成的哨子，一看就是心灵手巧的工匠做的。矮人可以用来召唤自己的坐骑。
66,狮鹫小像,紫晶森林,wenwu_66,2,一尊小小的狮鹫像。可能是矮人留下的，也可能是在矿洞新挖出来的。
67,黄金夜壶,紫晶森林,wenwu_67,3,纯黄金打造成的夜壶？不得不感叹矮人一族的富有与奢侈。
68,红宝石酒壶,紫晶森林,wenwu_68,3,鸡蛋大的红宝石镶嵌在酒壶上，通过宝石半透明的质地可以看见内部甘醇的葡萄酒。
69,国王权杖,紫晶森林,wenwu_69,4,矮人国王的权杖，上面镶嵌有多种名贵宝石。它一点被时间侵袭的痕迹都没有，依然光芒万丈。
70,燃烧的战锤,紫晶森林,wenwu_70,5,巨大沉重的战锤，它黑得发亮的锤面下是隐隐燃烧的烈焰。矮人族领袖的心爱之物。
71,亡灵的心脏,亡灵壁垒,wenwu_71,1,一颗灰中发绿的心脏。尽管是亡灵的心脏，却依然温热并有跳动感。
72,腐臭的液体,亡灵壁垒,wenwu_72,1,一小瓶腐臭的液体。不知是亡灵的什么分泌物。打开会释放气体让别人看到亡灵的一段记忆。
73,四散的人骨,亡灵壁垒,wenwu_73,1,四处散落的人骨头。有不少上面有着刀砍火烧的痕迹，看来这些勇士都经历了一场恶战。
74,亡灵血泪,亡灵壁垒,wenwu_74,1,装有亡灵怨恨力量的血泪瓶子。打开时传出的亡灵嚎叫听起来几乎要让人丧失理智。
75,亡灵雕文,亡灵壁垒,wenwu_75,2,一块有破损的石雕，上刻有大批制造亡灵的符文。可惜字迹并不十分清晰。
76,永眠护符,亡灵壁垒,wenwu_76,2,一块美丽的护身符，棱形的金丝环绕着中心的玛瑙。玛瑙中含有一个安详的灵魂。
77,亡灵头盔,亡灵壁垒,wenwu_77,3,亡灵骑士戴过的头盔。它陪伴着这些不朽的英雄经历了无数场战斗。
78,黄金胸甲,亡灵壁垒,wenwu_78,3,黄金打造的胸甲，虽然亡灵已经拥有不朽的生命，但这套胸甲仍具有防御力。
79,死亡面罩,亡灵壁垒,wenwu_79,4,亡灵先锋军战士所带的面罩，虽然工艺非凡，但仍然透露着亡灵独特的审美。
80,女皇图章,亡灵壁垒,wenwu_80,5,亡灵的领袖，伟大的女妖之皇专用物。见此物如见到女皇本人。印章时至今日仍有号令亡灵的威力。
81,泰坦圆盘,全地图,wenwu_81,4,  记载着泰坦年轮时间的圆盘，由注入奥术法力的原石制成。每个圆盘刻度下记载着世界中的大事件。
82,泰坦符文石,全地图,wenwu_82,4,  看似光洁无比的表面中纂刻有许多闪着微光的符文在静静浮动着。只有泰坦可以看懂这些神秘的符文。
83,泰坦巨剑,全地图,wenwu_83,4,  泰坦主神提取宇宙中最精纯的氪石打造的战神之剑，号称宇宙中永不言败的武器，其手下败将数不胜数。
84,泰坦王冠,全地图,wenwu_84,5,  泰坦中的创世之王创造了天空与广阔无涯的海洋，于是得意之余用海底最美的矿石打造了一顶只属于他自己的王冠。
85,泰坦王座,全地图,wenwu_85,5,  神殿中象征最高决策权的王座，王座中记载了泰坦的能量之力的源泉，因此成为世间各种族不惜性命也要得到的宝物。
